{
  "title": "Sample Test: Java Basics",
  "description": "An example closed test with two built-in challenges and one private question. Copy this folder to create your own.",
  "durationMinutes": 30,
  "mode": "closed",
  "maxSubmissions": 3,
  "questions": [
    { "id": "even-or-odd", "points": 20 },
    { "id": "fizzbuzz", "points": 30 },
    { "id": "sum-of-evens", "points": 50 }
  ]
}
